{
  "object_type": "cart",
  "contract_version": "0.1.0",
  "created_at": "2026-08-05T12:05:00Z",
  "cart_id": "cart-5001",
  "merchant_ref": { "ref_type": "merchant", "id": "merchant-101" },
  "revision": 1,
  "lines": [
    {
      "item_ref": { "ref_type": "sku", "id": "sku-1" },
      "offer_ref": { "ref_type": "offer", "id": "offer-9001" },
      "description": "One widget",
      "unit_amount": { "currency_code": "USD", "value": "10.00" },
      "quantity": 2
    }
  ],
  "subtotal": { "currency_code": "USD", "value": "20.00" },
  "total": { "currency_code": "USD", "value": "20.00" }
}
